### ISSUE TITLE
Moto Server Hangs When Run from Python Code vs from CLI with DuckDB

### ISSUE THREAD

**Issue by yuv-c** [getmoto/moto#8078]
**Description:** When running the Moto server from within Python code, the server hangs and does not respond to HTTP requests made via DuckDB. However, when running the Moto server as a standalone process from the CLI, with the same code exactly, it works as expected.

**Details:**
DuckDB supports querying S3 files directly using the `httpfs` [extension](https://duckdb.org/docs/extensions/httpfs/overview.html).
I have configured duckdb to route any urls `s3://...` to `http://localhost...` (see `duckdb_client` fixture).
I am using moto to create end-to-end tests, that some of them require reading (CSV) files from S3. When setting up the test with moto, I am successfully able to create a bucket and upload a file to the moto server. 
However, reading the file is succesful only when:
1. Using any of the duckdb clients in conftest.py file (see below) **and running the moto server from the CLI.** 
2. Using `duckdb_client` (not `dttlv_duckdb_client`) and running moto server either from Python or CLI.

When running moto server from Python as part of the test, and using a wrapper for the duckdb client (`dttlv_duckdb_client`) the process hangs (see logs).
Since our team uses a class to wrap the duckdb client, we cannot use moto server directly in Python.
I have defined 3 tests. The first is a sanity check, the second one, which uses a class wrapper for duckdb, fails (and hangs), and third, which doens't wrap duckdb, passes (when commenting out the second test).

**Steps to Reproduce:**
> Python version: 3.11
> MacOS ARM
> duckdb=0.10.0
> moto=5.0.13
> pytest=7.4.3

**Expected Behavior:** The Moto server should respond to HTTP requests promptly, and the DuckDB query should execute successfully.

**Actual Behavior:** The Moto server hangs and does not respond to HTTP requests, causing the DuckDB query to hang as well.

**Test files and utils:**
conftest.py
```
from pytest import fixture
import os
import boto3
from moto import mock_aws
from moto.server import ThreadedMotoServer
from utils.logger import data_logger as logger
from utils.data_clients.duckdb_client import DuckDBClient
import duckdb

PORT = 5000
HOST = "127.0.0.1"
MOTO_SERVER_URL = f"http://{HOST}:{PORT}"
CSV_DIR = os.path.join(os.path.dirname(__file__), "csv_files")
BUCKET_NAME = "some-bucket"


@fixture(scope="module", autouse=True)
def moto_server():
    logger.info("Starting moto server...")
    server = ThreadedMotoServer(port=PORT, ip_address=HOST)
    server.start()
    logger.info("Moto server started.")
    host, port = server.get_host_and_port()
    yield f"http://{host}:{port}"
    logger.info("Stopping moto server...")
    server.stop()
    pass


@fixture
@mock_aws
def boto_s3_client():
    client = boto3.client("s3", endpoint_url=MOTO_SERVER_URL)
    return client


@fixture
def duckdb_client():
    logger.info("Setting up duckdb client...")

    client = duckdb.connect()
    client.sql(
        f"""
            CREATE SECRET (TYPE S3,
            KEY_ID '...',
            SECRET '...',
            REGION 'us-east-1',
            ENDPOINT '{HOST}:{PORT}',
            USE_SSL 'false',
            URL_STYLE 'path');"""
    )
    return client


@fixture
def dttlv_duckdb_client():
    with DuckDBClient() as client:
        client.execute(
            f"""
                CREATE SECRET (TYPE S3,
                KEY_ID '...',
                SECRET '...',
                REGION 'us-east-1',
                ENDPOINT '{HOST}:{PORT}',
                USE_SSL 'false',
                URL_STYLE 'path');"""
        )
        yield client


def create_bucket(boto_client):
    logger.info("Creating bucket...")
    boto_client.create_bucket(Bucket=BUCKET_NAME)
    logger.info("Bucket created successfully.")


def upload_file(boto_client):
    csv_file_path = os.path.join(CSV_DIR, "input/input_1.csv")
    bucket_name = BUCKET_NAME
    key = "input/input_1.csv"
    logger.info("Uploading file to bucket...")
    boto_client.upload_file(Bucket=bucket_name, Key=key, Filename=csv_file_path)
    logger.info("File uploaded to bucket successfully.")


@fixture(scope="function", autouse=True)
def foo_setup(moto_server, boto_s3_client):
    logger.info("Setup running...")
    create_bucket(boto_client=boto_s3_client)
    upload_file(boto_client=boto_s3_client)
    logger.info("Setup complete.")

```

test_file.py
```
import json
from utils.logger import data_logger as logger


BUCKET_NAME = "some-bucket"


def test_list_files(boto_s3_client):
    assert len(boto_s3_client.list_objects(Bucket=BUCKET_NAME)["Contents"]) == 1


def test_dttlv_duckdb_functionality(dttlv_duckdb_client):
    s3_uri = f"s3://{BUCKET_NAME}/input/input_1.csv"
    logger.info("Fetching data from s3...")

    ###############***** This is also failing *****################
    # boto_s3_client.put_object(Key="a", Bucket=BUCKET_NAME, Body=json.dumps({"a": 1}))
    # res = duckdb_client.execute("SELECT * FROM READ_JSON('s3://some-bucket/a')")
    # print(res)
    ###############################################################

    res = dttlv_duckdb_client.execute(
        f"SELECT * FROM READ_CSV('{s3_uri}', AUTO_DETECT=TRUE, SKIP=11, FILENAME=TRUE)"
    )
    logger.info("Fetched data from s3 successfully.")
    print(res)


def test_duckdb_functionality(duckdb_client, boto_s3_client):
    s3_uri = f"s3://{BUCKET_NAME}/input/input_1.csv"
    logger.info("Fetching data from s3...")

    boto_s3_client.put_object(Key="a", Bucket=BUCKET_NAME, Body=json.dumps({"a": 1}))
    res = duckdb_client.execute("SELECT * FROM READ_JSON('s3://some-bucket/a')")
    print(res)

    res = duckdb_client.execute(
        f"SELECT * FROM READ_CSV('{s3_uri}', AUTO_DETECT=TRUE, SKIP=11, FILENAME=TRUE)"
    ).fetchall()
    # res = duckdb_client.execute("select 1;")
    logger.info("Fetched data from s3... :):):)")
    print(res)
```

duckdb_client.py:
```
from typing import Optional

import duckdb


class DuckDBClient:
    def __init__(self, db_file: Optional[str] = None):
        self.duck_connection = duckdb.connect(db_file) if db_file else duckdb.connect()

    def __enter__(self):
        return self

    def __exit__(self, exc_type, exc_val, exc_tb):
        if self.duck_connection is not None:
            self.duck_connection.close()
        self.duck_connection = None

    def execute(self, sql: str):
        return self.duck_connection.sql(sql)
```

logs:
Case 1, running server from the fixture (process hangs):

> /Users/cyuval/tlvdata/.venv/bin/python /Applications/PyCharm.app/Contents/plugins/python/helpers/pycharm/_jb_pytest_runner.py --path /Users/cyuval/tlvdata/tests/packages/fsx_consumption/test_fsx_consumption_fetcher.py 
> Testing started at 16:26 ...
> Launching pytest with arguments /Users/cyuval/tlvdata/tests/packages/fsx_consumption/test_fsx_consumption_fetcher.py --no-header --no-summary -q in /Users/cyuval/tlvdata/tests/packages/fsx_consumption
> 
> ============================= test session starts ==============================
> collecting ... collected 3 items
> 
> test_fsx_consumption_fetcher.py::test_list_files 
> test_fsx_consumption_fetcher.py::test_dttlv_duckdb_functionality 2024-09-02 16:26:07,991 | INFO | conftest.py:19 | Starting moto server...
> Starting a new Thread with MotoServer running on 127.0.0.1:5000...
> 2024-09-02 16:26:07,992 | INFO | conftest.py:22 | Moto server started.
> 2024-09-02 16:26:08,167 | INFO | conftest.py:88 | Setup running...
> 2024-09-02 16:26:08,167 | INFO | conftest.py:72 | Creating bucket...
> 2024-09-02 16:26:08,194 | INFO | conftest.py:74 | Bucket created successfully.
> 2024-09-02 16:26:08,194 | INFO | conftest.py:81 | Uploading file to bucket...
> 2024-09-02 16:26:08,199 | INFO | conftest.py:83 | File uploaded to bucket successfully.
> 2024-09-02 16:26:08,199 | INFO | conftest.py:91 | Setup complete.
> PASSED                  [ 33%]2024-09-02 16:26:08,342 | INFO | conftest.py:88 | Setup running...
> 2024-09-02 16:26:08,342 | INFO | conftest.py:72 | Creating bucket...
> 2024-09-02 16:26:08,346 | INFO | conftest.py:74 | Bucket created successfully.
> 2024-09-02 16:26:08,346 | INFO | conftest.py:81 | Uploading file to bucket...
> 2024-09-02 16:26:08,349 | INFO | conftest.py:83 | File uploaded to bucket successfully.
> 2024-09-02 16:26:08,349 | INFO | conftest.py:91 | Setup complete.
> 
> Process finished with exit code 137 (interrupted by signal 9:SIGKILL)

Wireshark logs (case 1 - switched to port 50010 for less noise):
> 1	0.000000	127.0.0.1	127.0.0.1	TCP	68	56165 → 50010 [SYN] Seq=0 Win=65535 Len=0 MSS=16344 WS=64 TSval=1261901023 TSecr=0 SACK_PERM
> 2	0.000254	127.0.0.1	127.0.0.1	TCP	68	50010 → 56165 [SYN, ACK] Seq=0 Ack=1 Win=65535 Len=0 MSS=16344 WS=64 TSval=2444356555 TSecr=1261901023 SACK_PERM
> 3	0.000281	127.0.0.1	127.0.0.1	TCP	56	56165 → 50010 [ACK] Seq=1 Ack=1 Win=408256 Len=0 TSval=1261901023 TSecr=2444356555
> 4	0.000299	127.0.0.1	127.0.0.1	HTTP	735	PUT /some-bucket HTTP/1.1 
> 5	0.000303	127.0.0.1	127.0.0.1	TCP	56	[TCP Window Update] 50010 → 56165 [ACK] Seq=1 Ack=1 Win=408256 Len=0 TSval=2444356555 TSecr=1261901023
> 6	0.000321	127.0.0.1	127.0.0.1	TCP	56	50010 → 56165 [ACK] Seq=1 Ack=680 Win=407616 Len=0 TSval=2444356555 TSecr=1261901023
> 7	0.025020	127.0.0.1	127.0.0.1	TCP	334	50010 → 56165 [PSH, ACK] Seq=1 Ack=680 Win=407616 Len=278 TSval=2444356580 TSecr=1261901023 [TCP PDU reassembled in 9]
> 8	0.025094	127.0.0.1	127.0.0.1	TCP	56	56165 → 50010 [ACK] Seq=680 Ack=279 Win=408000 Len=0 TSval=1261901048 TSecr=2444356580
> 9	0.025129	127.0.0.1	127.0.0.1	HTTP	221	HTTP/1.1 200 OK  (text/html)
> 10	0.025145	127.0.0.1	127.0.0.1	TCP	56	56165 → 50010 [ACK] Seq=680 Ack=444 Win=407808 Len=0 TSval=1261901048 TSecr=2444356580
> 11	0.025301	127.0.0.1	127.0.0.1	TCP	56	56165 → 50010 [FIN, ACK] Seq=680 Ack=444 Win=407808 Len=0 TSval=1261901048 TSecr=2444356580
> 12	0.025331	127.0.0.1	127.0.0.1	TCP	56	50010 → 56165 [ACK] Seq=444 Ack=681 Win=407616 Len=0 TSval=2444356580 TSecr=1261901048
> 13	0.025764	127.0.0.1	127.0.0.1	TCP	56	50010 → 56165 [FIN, ACK] Seq=444 Ack=681 Win=407616 Len=0 TSval=2444356580 TSecr=1261901048
> 14	0.025833	127.0.0.1	127.0.0.1	TCP	56	56165 → 50010 [ACK] Seq=681 Ack=445 Win=407808 Len=0 TSval=1261901048 TSecr=2444356580
> 15	0.027297	127.0.0.1	127.0.0.1	TCP	68	56166 → 50010 [SYN] Seq=0 Win=65535 Len=0 MSS=16344 WS=64 TSval=1997839351 TSecr=0 SACK_PERM
> 16	0.027493	127.0.0.1	127.0.0.1	TCP	68	50010 → 56166 [SYN, ACK] Seq=0 Ack=1 Win=65535 Len=0 MSS=16344 WS=64 TSval=472403438 TSecr=1997839351 SACK_PERM
> 17	0.027517	127.0.0.1	127.0.0.1	TCP	56	56166 → 50010 [ACK] Seq=1 Ack=1 Win=408256 Len=0 TSval=1997839351 TSecr=472403438
> 18	0.027533	127.0.0.1	127.0.0.1	TCP	829	56166 → 50010 [PSH, ACK] Seq=1 Ack=1 Win=408256 Len=773 TSval=1997839351 TSecr=472403438 [TCP PDU reassembled in 25]
> 19	0.027539	127.0.0.1	127.0.0.1	TCP	56	[TCP Window Update] 50010 → 56166 [ACK] Seq=1 Ack=1 Win=408256 Len=0 TSval=472403438 TSecr=1997839351
> 20	0.027556	127.0.0.1	127.0.0.1	TCP	56	50010 → 56166 [ACK] Seq=1 Ack=774 Win=407488 Len=0 TSval=472403438 TSecr=1997839351
> 21	0.027718	127.0.0.1	127.0.0.1	HTTP	81	HTTP/1.1 100 Continue 
> 22	0.027744	127.0.0.1	127.0.0.1	TCP	56	56166 → 50010 [ACK] Seq=774 Ack=26 Win=408256 Len=0 TSval=1997839351 TSecr=472403438
> 23	0.027762	127.0.0.1	127.0.0.1	HTTP	81	HTTP/1.1 100 Continue 
> 24	0.027786	127.0.0.1	127.0.0.1	TCP	56	56166 → 50010 [ACK] Seq=774 Ack=51 Win=408192 Len=0 TSval=1997839351 TSecr=472403438
> 25	0.027853	127.0.0.1	127.0.0.1	HTTP	2305	PUT /some-bucket/input/input_1.csv HTTP/1.1 
> 26	0.027889	127.0.0.1	127.0.0.1	TCP	56	50010 → 56166 [ACK] Seq=51 Ack=3023 Win=405248 Len=0 TSval=472403438 TSecr=1997839351
> 27	0.029119	127.0.0.1	127.0.0.1	HTTP	420	HTTP/1.1 200 OK 
> 28	0.029162	127.0.0.1	127.0.0.1	TCP	56	56166 → 50010 [ACK] Seq=3023 Ack=415 Win=407872 Len=0 TSval=1997839353 TSecr=472403440
> 29	0.029276	127.0.0.1	127.0.0.1	TCP	56	56166 → 50010 [FIN, ACK] Seq=3023 Ack=415 Win=407872 Len=0 TSval=1997839353 TSecr=472403440
> 30	0.029314	127.0.0.1	127.0.0.1	TCP	56	50010 → 56166 [ACK] Seq=415 Ack=3024 Win=405248 Len=0 TSval=472403440 TSecr=1997839353
> 31	0.029474	127.0.0.1	127.0.0.1	TCP	56	50010 → 56166 [FIN, ACK] Seq=415 Ack=3024 Win=405248 Len=0 TSval=472403440 TSecr=1997839353
> 32	0.029521	127.0.0.1	127.0.0.1	TCP	56	56166 → 50010 [ACK] Seq=3024 Ack=416 Win=407872 Len=0 TSval=1997839353 TSecr=472403440
> 33	0.030795	127.0.0.1	127.0.0.1	TCP	68	56167 → 50010 [SYN] Seq=0 Win=65535 Len=0 MSS=16344 WS=64 TSval=4217073575 TSecr=0 SACK_PERM
> 34	0.031007	127.0.0.1	127.0.0.1	TCP	68	50010 → 56167 [SYN, ACK] Seq=0 Ack=1 Win=65535 Len=0 MSS=16344 WS=64 TSval=4252980423 TSecr=4217073575 SACK_PERM
> 35	0.031038	127.0.0.1	127.0.0.1	TCP	56	56167 → 50010 [ACK] Seq=1 Ack=1 Win=408256 Len=0 TSval=4217073575 TSecr=4252980423
> 36	0.031051	127.0.0.1	127.0.0.1	HTTP	734	GET /some-bucket?encoding-type=url HTTP/1.1 
> 37	0.031078	127.0.0.1	127.0.0.1	TCP	56	[TCP Window Update] 50010 → 56167 [ACK] Seq=1 Ack=1 Win=408256 Len=0 TSval=4252980423 TSecr=4217073575
> 38	0.031111	127.0.0.1	127.0.0.1	TCP	56	50010 → 56167 [ACK] Seq=1 Ack=679 Win=407616 Len=0 TSval=4252980423 TSecr=4217073575
> 39	0.034028	127.0.0.1	127.0.0.1	TCP	334	50010 → 56167 [PSH, ACK] Seq=1 Ack=679 Win=407616 Len=278 TSval=4252980426 TSecr=4217073575 [TCP PDU reassembled in 41]
> 40	0.034075	127.0.0.1	127.0.0.1	TCP	56	56167 → 50010 [ACK] Seq=679 Ack=279 Win=408000 Len=0 TSval=4217073578 TSecr=4252980426
> 41	0.034107	127.0.0.1	127.0.0.1	HTTP/XML	623	HTTP/1.1 200 OK 
> 42	0.034131	127.0.0.1	127.0.0.1	TCP	56	56167 → 50010 [ACK] Seq=679 Ack=846 Win=407424 Len=0 TSval=4217073578 TSecr=4252980426
> 43	0.034207	127.0.0.1	127.0.0.1	TCP	56	56167 → 50010 [FIN, ACK] Seq=679 Ack=846 Win=407424 Len=0 TSval=4217073578 TSecr=4252980426
> 44	0.034248	127.0.0.1	127.0.0.1	TCP	56	50010 → 56167 [ACK] Seq=846 Ack=680 Win=407616 Len=0 TSval=4252980426 TSecr=4217073578
> 45	0.034601	127.0.0.1	127.0.0.1	TCP	56	50010 → 56167 [FIN, ACK] Seq=846 Ack=680 Win=407616 Len=0 TSval=4252980426 TSecr=4217073578
> 46	0.034658	127.0.0.1	127.0.0.1	TCP	56	56167 → 50010 [ACK] Seq=680 Ack=847 Win=407424 Len=0 TSval=4217073578 TSecr=4252980426
> 47	0.178591	127.0.0.1	127.0.0.1	TCP	68	56168 → 50010 [SYN] Seq=0 Win=65535 Len=0 MSS=16344 WS=64 TSval=1440782420 TSecr=0 SACK_PERM
> 48	0.178979	127.0.0.1	127.0.0.1	TCP	68	50010 → 56168 [SYN, ACK] Seq=0 Ack=1 Win=65535 Len=0 MSS=16344 WS=64 TSval=136312347 TSecr=1440782420 SACK_PERM
> 49	0.179018	127.0.0.1	127.0.0.1	TCP	56	56168 → 50010 [ACK] Seq=1 Ack=1 Win=408256 Len=0 TSval=1440782420 TSecr=136312347
> 50	0.179041	127.0.0.1	127.0.0.1	HTTP	735	PUT /some-bucket HTTP/1.1 
> 51	0.179046	127.0.0.1	127.0.0.1	TCP	56	[TCP Window Update] 50010 → 56168 [ACK] Seq=1 Ack=1 Win=408256 Len=0 TSval=136312347 TSecr=1440782420
> 52	0.179069	127.0.0.1	127.0.0.1	TCP	56	50010 → 56168 [ACK] Seq=1 Ack=680 Win=407616 Len=0 TSval=136312347 TSecr=1440782420
> 53	0.180728	127.0.0.1	127.0.0.1	TCP	334	50010 → 56168 [PSH, ACK] Seq=1 Ack=680 Win=407616 Len=278 TSval=136312349 TSecr=1440782420 [TCP PDU reassembled in 55]
> 54	0.180807	127.0.0.1	127.0.0.1	TCP	56	56168 → 50010 [ACK] Seq=680 Ack=279 Win=408000 Len=0 TSval=1440782422 TSecr=136312349
> 55	0.180872	127.0.0.1	127.0.0.1	HTTP	221	HTTP/1.1 200 OK  (text/html)
> 56	0.180924	127.0.0.1	127.0.0.1	TCP	56	56168 → 50010 [ACK] Seq=680 Ack=444 Win=407808 Len=0 TSval=1440782422 TSecr=136312349
> 57	0.180937	127.0.0.1	127.0.0.1	TCP	56	56168 → 50010 [FIN, ACK] Seq=680 Ack=444 Win=407808 Len=0 TSval=1440782422 TSecr=136312349
> 58	0.180964	127.0.0.1	127.0.0.1	TCP	56	50010 → 56168 [ACK] Seq=444 Ack=681 Win=407616 Len=0 TSval=136312349 TSecr=1440782422
> 59	0.181328	127.0.0.1	127.0.0.1	TCP	56	50010 → 56168 [FIN, ACK] Seq=444 Ack=681 Win=407616 Len=0 TSval=136312349 TSecr=1440782422
> 60	0.181362	127.0.0.1	127.0.0.1	TCP	56	56168 → 50010 [ACK] Seq=681 Ack=445 Win=407808 Len=0 TSval=1440782422 TSecr=136312349
> 61	0.182555	127.0.0.1	127.0.0.1	TCP	68	56169 → 50010 [SYN] Seq=0 Win=65535 Len=0 MSS=16344 WS=64 TSval=3018662253 TSecr=0 SACK_PERM
> 62	0.182818	127.0.0.1	127.0.0.1	TCP	68	50010 → 56169 [SYN, ACK] Seq=0 Ack=1 Win=65535 Len=0 MSS=16344 WS=64 TSval=3547981526 TSecr=3018662253 SACK_PERM
> 63	0.182889	127.0.0.1	127.0.0.1	TCP	56	56169 → 50010 [ACK] Seq=1 Ack=1 Win=408256 Len=0 TSval=3018662253 TSecr=3547981526
> 64	0.182923	127.0.0.1	127.0.0.1	TCP	829	56169 → 50010 [PSH, ACK] Seq=1 Ack=1 Win=408256 Len=773 TSval=3018662253 TSecr=3547981526 [TCP PDU reassembled in 71]
> 65	0.182952	127.0.0.1	127.0.0.1	TCP	56	[TCP Window Update] 50010 → 56169 [ACK] Seq=1 Ack=1 Win=408256 Len=0 TSval=3547981526 TSecr=3018662253
> 66	0.183020	127.0.0.1	127.0.0.1	TCP	56	50010 → 56169 [ACK] Seq=1 Ack=774 Win=407488 Len=0 TSval=3547981526 TSecr=3018662253
> 67	0.183201	127.0.0.1	127.0.0.1	HTTP	81	HTTP/1.1 100 Continue 
> 68	0.183228	127.0.0.1	127.0.0.1	TCP	56	56169 → 50010 [ACK] Seq=774 Ack=26 Win=408256 Len=0 TSval=3018662253 TSecr=3547981526
> 69	0.183244	127.0.0.1	127.0.0.1	HTTP	81	HTTP/1.1 100 Continue 
> 70	0.183257	127.0.0.1	127.0.0.1	TCP	56	56169 → 50010 [ACK] Seq=774 Ack=51 Win=408192 Len=0 TSval=3018662253 TSecr=3547981526
> 71	0.183354	127.0.0.1	127.0.0.1	HTTP	2305	PUT /some-bucket/input/input_1.csv HTTP/1.1 
> 72	0.183377	127.0.0.1	127.0.0.1	TCP	56	50010 → 56169 [ACK] Seq=51 Ack=3023 Win=405248 Len=0 TSval=3547981526 TSecr=3018662253
> 73	0.184280	127.0.0.1	127.0.0.1	HTTP	420	HTTP/1.1 200 OK 
> 74	0.184351	127.0.0.1	127.0.0.1	TCP	56	56169 → 50010 [ACK] Seq=3023 Ack=415 Win=407872 Len=0 TSval=3018662254 TSecr=3547981527
> 75	0.184464	127.0.0.1	127.0.0.1	TCP	56	56169 → 50010 [FIN, ACK] Seq=3023 Ack=415 Win=407872 Len=0 TSval=3018662254 TSecr=3547981527
> 76	0.184536	127.0.0.1	127.0.0.1	TCP	56	50010 → 56169 [ACK] Seq=415 Ack=3024 Win=405248 Len=0 TSval=3547981527 TSecr=3018662254
> 77	0.184673	127.0.0.1	127.0.0.1	TCP	56	50010 → 56169 [FIN, ACK] Seq=415 Ack=3024 Win=405248 Len=0 TSval=3547981527 TSecr=3018662254
> 78	0.184753	127.0.0.1	127.0.0.1	TCP	56	56169 → 50010 [ACK] Seq=3024 Ack=416 Win=407872 Len=0 TSval=3018662254 TSecr=3547981527
> 79	0.211166	127.0.0.1	127.0.0.1	TCP	68	56170 → 50010 [SYN] Seq=0 Win=65535 Len=0 MSS=16344 WS=64 TSval=2125537756 TSecr=0 SACK_PERM
> 80	0.211359	127.0.0.1	127.0.0.1	TCP	68	50010 → 56170 [SYN, ACK] Seq=0 Ack=1 Win=65535 Len=0 MSS=16344 WS=64 TSval=3236353137 TSecr=2125537756 SACK_PERM
> 81	0.211396	127.0.0.1	127.0.0.1	TCP	56	56170 → 50010 [ACK] Seq=1 Ack=1 Win=408256 Len=0 TSval=2125537756 TSecr=3236353137
> 82	0.211425	127.0.0.1	127.0.0.1	TCP	56	[TCP Window Update] 50010 → 56170 [ACK] Seq=1 Ack=1 Win=408256 Len=0 TSval=3236353137 TSecr=2125537756
> 83	0.211447	127.0.0.1	127.0.0.1	HTTP	501	HEAD /some-bucket/input/input_1.csv HTTP/1.1 
> 84	0.211485	127.0.0.1	127.0.0.1	TCP	56	50010 → 56170 [ACK] Seq=1 Ack=446 Win=407808 Len=0 TSval=3236353137 TSecr=2125537756
> 85	7.877015	127.0.0.1	127.0.0.1	TCP	56	56170 → 50010 [FIN, ACK] Seq=446 Ack=1 Win=408256 Len=0 TSval=2125545422 TSecr=3236353137
> 86	7.877025	127.0.0.1	127.0.0.1	TCP	44	50010 → 56170 [RST, ACK] Seq=1 Ack=446 Win=407808 Len=0

Case 2, commenting out the moto server fixture creation and running from CLI `moto_server -p5000` (port 50010 for wireshark):

> /Users/cyuval/tlvdata/.venv/bin/python /Applications/PyCharm.app/Contents/plugins/python/helpers/pycharm/_jb_pytest_runner.py --path /Users/cyuval/tlvdata/tests/packages/fsx_consumption/test_fsx_consumption_fetcher.py 
> Testing started at 16:36 ...
> Launching pytest with arguments /Users/cyuval/tlvdata/tests/packages/fsx_consumption/test_fsx_consumption_fetcher.py --no-header --no-summary -q in /Users/cyuval/tlvdata/tests/packages/fsx_consumption
> 
> ============================= test session starts ==============================
> collecting ... collected 3 items
> 
> test_fsx_consumption_fetcher.py::test_list_files 
> test_fsx_consumption_fetcher.py::test_dttlv_duckdb_functionality 
> test_fsx_consumption_fetcher.py::test_duckdb_functionality 
> 
> ============================== 3 passed in 0.79s ===============================
> 2024-09-02 16:36:05,627 | INFO | conftest.py:88 | Setup running...
> 2024-09-02 16:36:05,627 | INFO | conftest.py:72 | Creating bucket...
> 2024-09-02 16:36:05,673 | INFO | conftest.py:74 | Bucket created successfully.
> 2024-09-02 16:36:05,673 | INFO | conftest.py:81 | Uploading file to bucket...
> 2024-09-02 16:36:05,678 | INFO | conftest.py:83 | File uploaded to bucket successfully.
> 2024-09-02 16:36:05,678 | INFO | conftest.py:91 | Setup complete.
> PASSED                  [ 33%]2024-09-02 16:36:05,823 | INFO | conftest.py:88 | Setup running...
> 2024-09-02 16:36:05,823 | INFO | conftest.py:72 | Creating bucket...
> 2024-09-02 16:36:05,835 | INFO | conftest.py:74 | Bucket created successfully.
> 2024-09-02 16:36:05,835 | INFO | conftest.py:81 | Uploading file to bucket...
> 2024-09-02 16:36:05,843 | INFO | conftest.py:83 | File uploaded to bucket successfully.
> 2024-09-02 16:36:05,843 | INFO | conftest.py:91 | Setup complete.
> PASSED  [ 66%]2024-09-02 16:36:05,868 | INFO | test_fsx_consumption_fetcher.py:14 | Fetching data from s3...
> 2024-09-02 16:36:05,880 | INFO | test_fsx_consumption_fetcher.py:25 | Fetched data from s3 successfully.
> ┌────────────┬────────────┬───────────────┬───────────┬─────────┬────────────────────────────────────┐
> │  column0   │  column1   │    column2    │  column3  │ column4 │              filename              │
> │    date    │    date    │    varchar    │  varchar  │  int64  │              varchar               │
> ├────────────┼────────────┼───────────────┼───────────┼─────────┼────────────────────────────────────┤
> │ 2024-07-07 │ 2024-07-13 │ ... │ s3://some-bucket/input/input_1.csv │
> │     ·      │     ·      │  ·            │  ·        │     ·   │                 ·                  │
> │     ·      │     ·      │  ·            │  ·        │     ·   │                 ·                  │
> │     ·      │     ·      │  ·            │  ·        │     ·   │                 ·                  │
> ───────┴─────────┴────────────────────────────────────┤
> │ 30 rows (20 shown)                                                                       6 columns │
> └────────────────────────────────────────────────────────────────────────────────────────────────────┘
> 
> 2024-09-02 16:36:06,003 | INFO | conftest.py:88 | Setup running...
> 2024-09-02 16:36:06,003 | INFO | conftest.py:72 | Creating bucket...
> 2024-09-02 16:36:06,009 | INFO | conftest.py:74 | Bucket created successfully.
> 2024-09-02 16:36:06,009 | INFO | conftest.py:81 | Uploading file to bucket...
> 2024-09-02 16:36:06,017 | INFO | conftest.py:83 | File uploaded to bucket successfully.
> 2024-09-02 16:36:06,017 | INFO | conftest.py:91 | Setup complete.
> 2024-09-02 16:36:06,017 | INFO | conftest.py:39 | Setting up duckdb client...
> PASSED        [100%]2024-09-02 16:36:06,025 | INFO | test_fsx_consumption_fetcher.py:31 | Fetching data from s3...
> <duckdb.duckdb.DuckDBPyConnection object at 0x107b27130>
> 2024-09-02 16:36:06,048 | INFO | test_fsx_consumption_fetcher.py:41 | Fetched data from s3... :):):)
> [(datetime.date(2024, 7, 7), datetime.date(2024, 7, 13), ....]
> 
> Process finished with exit code 0

Wireshark logs case 2:

> 1	0.000000	127.0.0.1	127.0.0.1	TCP	68	56262 → 50010 [SYN] Seq=0 Win=65535 Len=0 MSS=16344 WS=64 TSval=2361936117 TSecr=0 SACK_PERM
> 2	0.000213	127.0.0.1	127.0.0.1	TCP	68	50010 → 56262 [SYN, ACK] Seq=0 Ack=1 Win=65535 Len=0 MSS=16344 WS=64 TSval=3869370437 TSecr=2361936117 SACK_PERM
> 3	0.000240	127.0.0.1	127.0.0.1	TCP	56	56262 → 50010 [ACK] Seq=1 Ack=1 Win=408256 Len=0 TSval=2361936117 TSecr=3869370437
> 4	0.000260	127.0.0.1	127.0.0.1	HTTP	735	PUT /some-bucket HTTP/1.1 
> 5	0.000261	127.0.0.1	127.0.0.1	TCP	56	[TCP Window Update] 50010 → 56262 [ACK] Seq=1 Ack=1 Win=408256 Len=0 TSval=3869370437 TSecr=2361936117
> 6	0.000279	127.0.0.1	127.0.0.1	TCP	56	50010 → 56262 [ACK] Seq=1 Ack=680 Win=407616 Len=0 TSval=3869370437 TSecr=2361936117
> 7	0.043369	127.0.0.1	127.0.0.1	TCP	334	50010 → 56262 [PSH, ACK] Seq=1 Ack=680 Win=407616 Len=278 TSval=3869370481 TSecr=2361936117 [TCP PDU reassembled in 9]
> 8	0.043436	127.0.0.1	127.0.0.1	TCP	56	56262 → 50010 [ACK] Seq=680 Ack=279 Win=408000 Len=0 TSval=2361936161 TSecr=3869370481
> 9	0.043469	127.0.0.1	127.0.0.1	HTTP	221	HTTP/1.1 200 OK  (text/html)
> 10	0.043488	127.0.0.1	127.0.0.1	TCP	56	56262 → 50010 [ACK] Seq=680 Ack=444 Win=407808 Len=0 TSval=2361936161 TSecr=3869370481
> 11	0.043658	127.0.0.1	127.0.0.1	TCP	56	56262 → 50010 [FIN, ACK] Seq=680 Ack=444 Win=407808 Len=0 TSval=2361936161 TSecr=3869370481
> 12	0.043694	127.0.0.1	127.0.0.1	TCP	56	50010 → 56262 [ACK] Seq=444 Ack=681 Win=407616 Len=0 TSval=3869370481 TSecr=2361936161
> 13	0.043751	127.0.0.1	127.0.0.1	TCP	56	50010 → 56262 [FIN, ACK] Seq=444 Ack=681 Win=407616 Len=0 TSval=3869370481 TSecr=2361936161
> 14	0.043796	127.0.0.1	127.0.0.1	TCP	56	56262 → 50010 [ACK] Seq=681 Ack=445 Win=407808 Len=0 TSval=2361936161 TSecr=3869370481
> 15	0.045928	127.0.0.1	127.0.0.1	TCP	68	56263 → 50010 [SYN] Seq=0 Win=65535 Len=0 MSS=16344 WS=64 TSval=1405362781 TSecr=0 SACK_PERM
> 16	0.046169	127.0.0.1	127.0.0.1	TCP	68	50010 → 56263 [SYN, ACK] Seq=0 Ack=1 Win=65535 Len=0 MSS=16344 WS=64 TSval=1773702701 TSecr=1405362781 SACK_PERM
> 17	0.046201	127.0.0.1	127.0.0.1	TCP	56	56263 → 50010 [ACK] Seq=1 Ack=1 Win=408256 Len=0 TSval=1405362781 TSecr=1773702701
> 18	0.046221	127.0.0.1	127.0.0.1	TCP	829	56263 → 50010 [PSH, ACK] Seq=1 Ack=1 Win=408256 Len=773 TSval=1405362781 TSecr=1773702701 [TCP PDU reassembled in 25]
> 19	0.046226	127.0.0.1	127.0.0.1	TCP	56	[TCP Window Update] 50010 → 56263 [ACK] Seq=1 Ack=1 Win=408256 Len=0 TSval=1773702701 TSecr=1405362781
> 20	0.046251	127.0.0.1	127.0.0.1	TCP	56	50010 → 56263 [ACK] Seq=1 Ack=774 Win=407488 Len=0 TSval=1773702701 TSecr=1405362781
> 21	0.046454	127.0.0.1	127.0.0.1	HTTP	81	HTTP/1.1 100 Continue 
> 22	0.046486	127.0.0.1	127.0.0.1	TCP	56	56263 → 50010 [ACK] Seq=774 Ack=26 Win=408256 Len=0 TSval=1405362781 TSecr=1773702701
> 23	0.046509	127.0.0.1	127.0.0.1	HTTP	81	HTTP/1.1 100 Continue 
> 24	0.046539	127.0.0.1	127.0.0.1	TCP	56	56263 → 50010 [ACK] Seq=774 Ack=51 Win=408192 Len=0 TSval=1405362781 TSecr=1773702701
> 25	0.046642	127.0.0.1	127.0.0.1	HTTP	2305	PUT /some-bucket/input/input_1.csv HTTP/1.1 
> 26	0.046668	127.0.0.1	127.0.0.1	TCP	56	50010 → 56263 [ACK] Seq=51 Ack=3023 Win=405248 Len=0 TSval=1773702701 TSecr=1405362781
> 27	0.048196	127.0.0.1	127.0.0.1	HTTP	420	HTTP/1.1 200 OK 
> 28	0.048240	127.0.0.1	127.0.0.1	TCP	56	56263 → 50010 [ACK] Seq=3023 Ack=415 Win=407872 Len=0 TSval=1405362783 TSecr=1773702703
> 29	0.048386	127.0.0.1	127.0.0.1	TCP	56	56263 → 50010 [FIN, ACK] Seq=3023 Ack=415 Win=407872 Len=0 TSval=1405362783 TSecr=1773702703
> 30	0.048420	127.0.0.1	127.0.0.1	TCP	56	50010 → 56263 [ACK] Seq=415 Ack=3024 Win=405248 Len=0 TSval=1773702703 TSecr=1405362783
> 31	0.048453	127.0.0.1	127.0.0.1	TCP	56	50010 → 56263 [FIN, ACK] Seq=415 Ack=3024 Win=405248 Len=0 TSval=1773702704 TSecr=1405362783
> 32	0.048493	127.0.0.1	127.0.0.1	TCP	56	56263 → 50010 [ACK] Seq=3024 Ack=416 Win=407872 Len=0 TSval=1405362784 TSecr=1773702704
> 33	0.050084	127.0.0.1	127.0.0.1	TCP	68	56264 → 50010 [SYN] Seq=0 Win=65535 Len=0 MSS=16344 WS=64 TSval=1228101115 TSecr=0 SACK_PERM
> 34	0.050336	127.0.0.1	127.0.0.1	TCP	68	50010 → 56264 [SYN, ACK] Seq=0 Ack=1 Win=65535 Len=0 MSS=16344 WS=64 TSval=3862381895 TSecr=1228101115 SACK_PERM
> 35	0.050408	127.0.0.1	127.0.0.1	TCP	56	56264 → 50010 [ACK] Seq=1 Ack=1 Win=408256 Len=0 TSval=1228101115 TSecr=3862381895
> 36	0.050425	127.0.0.1	127.0.0.1	HTTP	734	GET /some-bucket?encoding-type=url HTTP/1.1 
> 37	0.050466	127.0.0.1	127.0.0.1	TCP	56	[TCP Window Update] 50010 → 56264 [ACK] Seq=1 Ack=1 Win=408256 Len=0 TSval=3862381895 TSecr=1228101115
> 38	0.050519	127.0.0.1	127.0.0.1	TCP	56	50010 → 56264 [ACK] Seq=1 Ack=679 Win=407616 Len=0 TSval=3862381895 TSecr=1228101115
> 39	0.053601	127.0.0.1	127.0.0.1	TCP	334	50010 → 56264 [PSH, ACK] Seq=1 Ack=679 Win=407616 Len=278 TSval=3862381899 TSecr=1228101115 [TCP PDU reassembled in 41]
> 40	0.053677	127.0.0.1	127.0.0.1	TCP	56	56264 → 50010 [ACK] Seq=679 Ack=279 Win=408000 Len=0 TSval=1228101119 TSecr=3862381899
> 41	0.053736	127.0.0.1	127.0.0.1	HTTP/XML	623	HTTP/1.1 200 OK 
> 42	0.053784	127.0.0.1	127.0.0.1	TCP	56	56264 → 50010 [ACK] Seq=679 Ack=846 Win=407424 Len=0 TSval=1228101119 TSecr=3862381899
> 43	0.053842	127.0.0.1	127.0.0.1	TCP	56	56264 → 50010 [FIN, ACK] Seq=679 Ack=846 Win=407424 Len=0 TSval=1228101119 TSecr=3862381899
> 44	0.053891	127.0.0.1	127.0.0.1	TCP	56	50010 → 56264 [ACK] Seq=846 Ack=680 Win=407616 Len=0 TSval=3862381899 TSecr=1228101119
> 45	0.053926	127.0.0.1	127.0.0.1	TCP	56	50010 → 56264 [FIN, ACK] Seq=846 Ack=680 Win=407616 Len=0 TSval=3862381899 TSecr=1228101119
> 46	0.053954	127.0.0.1	127.0.0.1	TCP	56	56264 → 50010 [ACK] Seq=680 Ack=847 Win=407424 Len=0 TSval=1228101119 TSecr=3862381899
> 47	0.189085	127.0.0.1	127.0.0.1	TCP	68	56265 → 50010 [SYN] Seq=0 Win=65535 Len=0 MSS=16344 WS=64 TSval=559622716 TSecr=0 SACK_PERM
> 48	0.189306	127.0.0.1	127.0.0.1	TCP	68	50010 → 56265 [SYN, ACK] Seq=0 Ack=1 Win=65535 Len=0 MSS=16344 WS=64 TSval=1451111297 TSecr=559622716 SACK_PERM
> 49	0.189340	127.0.0.1	127.0.0.1	TCP	56	56265 → 50010 [ACK] Seq=1 Ack=1 Win=408256 Len=0 TSval=559622716 TSecr=1451111297
> 50	0.189360	127.0.0.1	127.0.0.1	HTTP	735	PUT /some-bucket HTTP/1.1 
> 51	0.189366	127.0.0.1	127.0.0.1	TCP	56	[TCP Window Update] 50010 → 56265 [ACK] Seq=1 Ack=1 Win=408256 Len=0 TSval=1451111297 TSecr=559622716
> 52	0.189387	127.0.0.1	127.0.0.1	TCP	56	50010 → 56265 [ACK] Seq=1 Ack=680 Win=407616 Len=0 TSval=1451111297 TSecr=559622716
> 53	0.192922	127.0.0.1	127.0.0.1	TCP	334	50010 → 56265 [PSH, ACK] Seq=1 Ack=680 Win=407616 Len=278 TSval=1451111301 TSecr=559622716 [TCP PDU reassembled in 55]
> 54	0.192994	127.0.0.1	127.0.0.1	TCP	56	56265 → 50010 [ACK] Seq=680 Ack=279 Win=408000 Len=0 TSval=559622720 TSecr=1451111301
> 55	0.193035	127.0.0.1	127.0.0.1	HTTP	221	HTTP/1.1 200 OK  (text/html)
> 56	0.193060	127.0.0.1	127.0.0.1	TCP	56	56265 → 50010 [ACK] Seq=680 Ack=444 Win=407808 Len=0 TSval=559622720 TSecr=1451111301
> 57	0.193229	127.0.0.1	127.0.0.1	TCP	56	56265 → 50010 [FIN, ACK] Seq=680 Ack=444 Win=407808 Len=0 TSval=559622720 TSecr=1451111301
> 58	0.193288	127.0.0.1	127.0.0.1	TCP	56	50010 → 56265 [ACK] Seq=444 Ack=681 Win=407616 Len=0 TSval=1451111301 TSecr=559622720
> 59	0.193425	127.0.0.1	127.0.0.1	TCP	56	50010 → 56265 [FIN, ACK] Seq=444 Ack=681 Win=407616 Len=0 TSval=1451111301 TSecr=559622720
> 60	0.193489	127.0.0.1	127.0.0.1	TCP	56	56265 → 50010 [ACK] Seq=681 Ack=445 Win=407808 Len=0 TSval=559622720 TSecr=1451111301
> 61	0.195031	127.0.0.1	127.0.0.1	TCP	68	56266 → 50010 [SYN] Seq=0 Win=65535 Len=0 MSS=16344 WS=64 TSval=3247893539 TSecr=0 SACK_PERM
> 62	0.195280	127.0.0.1	127.0.0.1	TCP	68	50010 → 56266 [SYN, ACK] Seq=0 Ack=1 Win=65535 Len=0 MSS=16344 WS=64 TSval=1611450714 TSecr=3247893539 SACK_PERM
> 63	0.195307	127.0.0.1	127.0.0.1	TCP	56	56266 → 50010 [ACK] Seq=1 Ack=1 Win=408256 Len=0 TSval=3247893539 TSecr=1611450714
> 64	0.195328	127.0.0.1	127.0.0.1	TCP	56	[TCP Window Update] 50010 → 56266 [ACK] Seq=1 Ack=1 Win=408256 Len=0 TSval=1611450714 TSecr=3247893539
> 65	0.195335	127.0.0.1	127.0.0.1	TCP	829	56266 → 50010 [PSH, ACK] Seq=1 Ack=1 Win=408256 Len=773 TSval=3247893539 TSecr=1611450714 [TCP PDU reassembled in 71]
> 66	0.195356	127.0.0.1	127.0.0.1	TCP	56	50010 → 56266 [ACK] Seq=1 Ack=774 Win=407488 Len=0 TSval=1611450714 TSecr=3247893539
> 67	0.195918	127.0.0.1	127.0.0.1	HTTP	81	HTTP/1.1 100 Continue 
> 68	0.195953	127.0.0.1	127.0.0.1	TCP	56	56266 → 50010 [ACK] Seq=774 Ack=26 Win=408256 Len=0 TSval=3247893539 TSecr=1611450714
> 69	0.195987	127.0.0.1	127.0.0.1	HTTP	81	HTTP/1.1 100 Continue 
> 70	0.196013	127.0.0.1	127.0.0.1	TCP	56	56266 → 50010 [ACK] Seq=774 Ack=51 Win=408192 Len=0 TSval=3247893540 TSecr=1611450715
> 71	0.196090	127.0.0.1	127.0.0.1	HTTP	2305	PUT /some-bucket/input/input_1.csv HTTP/1.1 
> 72	0.196129	127.0.0.1	127.0.0.1	TCP	56	50010 → 56266 [ACK] Seq=51 Ack=3023 Win=405248 Len=0 TSval=1611450715 TSecr=3247893540
> 73	0.200707	127.0.0.1	127.0.0.1	HTTP	420	HTTP/1.1 200 OK 
> 74	0.200777	127.0.0.1	127.0.0.1	TCP	56	56266 → 50010 [ACK] Seq=3023 Ack=415 Win=407872 Len=0 TSval=3247893545 TSecr=1611450720
> 75	0.200978	127.0.0.1	127.0.0.1	TCP	56	56266 → 50010 [FIN, ACK] Seq=3023 Ack=415 Win=407872 Len=0 TSval=3247893545 TSecr=1611450720
> 76	0.201036	127.0.0.1	127.0.0.1	TCP	56	50010 → 56266 [ACK] Seq=415 Ack=3024 Win=405248 Len=0 TSval=1611450720 TSecr=3247893545
> 77	0.201154	127.0.0.1	127.0.0.1	TCP	56	50010 → 56266 [FIN, ACK] Seq=415 Ack=3024 Win=405248 Len=0 TSval=1611450720 TSecr=3247893545
> 78	0.201223	127.0.0.1	127.0.0.1	TCP	56	56266 → 50010 [ACK] Seq=3024 Ack=416 Win=407872 Len=0 TSval=3247893545 TSecr=1611450720
> 79	0.228890	127.0.0.1	127.0.0.1	TCP	68	56267 → 50010 [SYN] Seq=0 Win=65535 Len=0 MSS=16344 WS=64 TSval=3454718580 TSecr=0 SACK_PERM
> 80	0.229121	127.0.0.1	127.0.0.1	TCP	68	50010 → 56267 [SYN, ACK] Seq=0 Ack=1 Win=65535 Len=0 MSS=16344 WS=64 TSval=4055755411 TSecr=3454718580 SACK_PERM
> 81	0.229149	127.0.0.1	127.0.0.1	TCP	56	56267 → 50010 [ACK] Seq=1 Ack=1 Win=408256 Len=0 TSval=3454718580 TSecr=4055755411
> 82	0.229174	127.0.0.1	127.0.0.1	TCP	56	[TCP Window Update] 50010 → 56267 [ACK] Seq=1 Ack=1 Win=408256 Len=0 TSval=4055755411 TSecr=3454718580
> 83	0.229192	127.0.0.1	127.0.0.1	HTTP	501	HEAD /some-bucket/input/input_1.csv HTTP/1.1 
> 84	0.229226	127.0.0.1	127.0.0.1	TCP	56	50010 → 56267 [ACK] Seq=1 Ack=446 Win=407808 Len=0 TSval=4055755411 TSecr=3454718580
> 85	0.232729	127.0.0.1	127.0.0.1	HTTP	567	HTTP/1.1 200 OK 
> 86	0.232766	127.0.0.1	127.0.0.1	TCP	56	56267 → 50010 [ACK] Seq=446 Ack=512 Win=407744 Len=0 TSval=3454718584 TSecr=4055755415
> 87	0.232811	127.0.0.1	127.0.0.1	TCP	56	56267 → 50010 [FIN, ACK] Seq=446 Ack=512 Win=407744 Len=0 TSval=3454718584 TSecr=4055755415
> 88	0.232838	127.0.0.1	127.0.0.1	TCP	56	50010 → 56267 [ACK] Seq=512 Ack=447 Win=407808 Len=0 TSval=4055755415 TSecr=3454718584
> 89	0.232897	127.0.0.1	127.0.0.1	TCP	68	56268 → 50010 [SYN] Seq=0 Win=65535 Len=0 MSS=16344 WS=64 TSval=2985815169 TSecr=0 SACK_PERM
> 90	0.232900	127.0.0.1	127.0.0.1	TCP	56	50010 → 56267 [FIN, ACK] Seq=512 Ack=447 Win=407808 Len=0 TSval=4055755415 TSecr=3454718584
> 91	0.233076	127.0.0.1	127.0.0.1	TCP	68	50010 → 56268 [SYN, ACK] Seq=0 Ack=1 Win=65535 Len=0 MSS=16344 WS=64 TSval=882591374 TSecr=2985815169 SACK_PERM
> 92	0.233094	127.0.0.1	127.0.0.1	TCP	56	56267 → 50010 [ACK] Seq=447 Ack=513 Win=407744 Len=0 TSval=3454718584 TSecr=4055755415
> 93	0.233113	127.0.0.1	127.0.0.1	TCP	56	56268 → 50010 [ACK] Seq=1 Ack=1 Win=408256 Len=0 TSval=2985815169 TSecr=882591374
> 94	0.233131	127.0.0.1	127.0.0.1	HTTP	521	GET /some-bucket/input/input_1.csv HTTP/1.1 
> 95	0.233145	127.0.0.1	127.0.0.1	TCP	56	[TCP Window Update] 50010 → 56268 [ACK] Seq=1 Ack=1 Win=408256 Len=0 TSval=882591374 TSecr=2985815169
> 96	0.233162	127.0.0.1	127.0.0.1	TCP	56	50010 → 56268 [ACK] Seq=1 Ack=466 Win=407808 Len=0 TSval=882591374 TSecr=2985815169
> 97	0.235793	127.0.0.1	127.0.0.1	TCP	614	50010 → 56268 [PSH, ACK] Seq=1 Ack=466 Win=407808 Len=558 TSval=882591377 TSecr=2985815169 [TCP PDU reassembled in 99]
> 98	0.235830	127.0.0.1	127.0.0.1	TCP	56	56268 → 50010 [ACK] Seq=466 Ack=559 Win=407680 Len=0 TSval=2985815172 TSecr=882591377
> 99	0.235853	127.0.0.1	127.0.0.1	HTTP	2305	HTTP/1.1 206 PARTIAL CONTENT  (binary/octet-stream)
> 100	0.235869	127.0.0.1	127.0.0.1	TCP	56	56268 → 50010 [ACK] Seq=466 Ack=2808 Win=405440 Len=0 TSval=2985815172 TSecr=882591377
> 101	0.235882	127.0.0.1	127.0.0.1	TCP	56	56268 → 50010 [FIN, ACK] Seq=466 Ack=2808 Win=405440 Len=0 TSval=2985815172 TSecr=882591377
> 102	0.235909	127.0.0.1	127.0.0.1	TCP	56	50010 → 56268 [ACK] Seq=2808 Ack=467 Win=407808 Len=0 TSval=882591377 TSecr=2985815172
> 103	0.235967	127.0.0.1	127.0.0.1	TCP	56	50010 → 56268 [FIN, ACK] Seq=2808 Ack=467 Win=407808 Len=0 TSval=882591377 TSecr=2985815172
> 104	0.236005	127.0.0.1	127.0.0.1	TCP	56	56268 → 50010 [ACK] Seq=467 Ack=2809 Win=405440 Len=0 TSval=2985815172 TSecr=882591377
> 105	0.237881	127.0.0.1	127.0.0.1	TCP	68	56269 → 50010 [SYN] Seq=0 Win=65535 Len=0 MSS=16344 WS=64 TSval=1480427243 TSecr=0 SACK_PERM
> 106	0.238143	127.0.0.1	127.0.0.1	TCP	68	50010 → 56269 [SYN, ACK] Seq=0 Ack=1 Win=65535 Len=0 MSS=16344 WS=64 TSval=3256884312 TSecr=1480427243 SACK_PERM
> 107	0.238174	127.0.0.1	127.0.0.1	TCP	56	56269 → 50010 [ACK] Seq=1 Ack=1 Win=408256 Len=0 TSval=1480427243 TSecr=3256884312
> 108	0.238188	127.0.0.1	127.0.0.1	HTTP	521	GET /some-bucket/input/input_1.csv HTTP/1.1 
> 109	0.238199	127.0.0.1	127.0.0.1	TCP	56	[TCP Window Update] 50010 → 56269 [ACK] Seq=1 Ack=1 Win=408256 Len=0 TSval=3256884312 TSecr=1480427243
> 110	0.238220	127.0.0.1	127.0.0.1	TCP	56	50010 → 56269 [ACK] Seq=1 Ack=466 Win=407808 Len=0 TSval=3256884312 TSecr=1480427243
> 111	0.241291	127.0.0.1	127.0.0.1	TCP	614	50010 → 56269 [PSH, ACK] Seq=1 Ack=466 Win=407808 Len=558 TSval=3256884316 TSecr=1480427243 [TCP PDU reassembled in 113]
> 112	0.241323	127.0.0.1	127.0.0.1	TCP	56	56269 → 50010 [ACK] Seq=466 Ack=559 Win=407680 Len=0 TSval=1480427247 TSecr=3256884316
> 113	0.241349	127.0.0.1	127.0.0.1	HTTP	2305	HTTP/1.1 206 PARTIAL CONTENT  (binary/octet-stream)
> 114	0.241369	127.0.0.1	127.0.0.1	TCP	56	56269 → 50010 [ACK] Seq=466 Ack=2808 Win=405440 Len=0 TSval=1480427247 TSecr=3256884316
> 115	0.241383	127.0.0.1	127.0.0.1	TCP	56	56269 → 50010 [FIN, ACK] Seq=466 Ack=2808 Win=405440 Len=0 TSval=1480427247 TSecr=3256884316
> 116	0.241423	127.0.0.1	127.0.0.1	TCP	56	50010 → 56269 [ACK] Seq=2808 Ack=467 Win=407808 Len=0 TSval=3256884316 TSecr=1480427247
> 117	0.241494	127.0.0.1	127.0.0.1	TCP	56	50010 → 56269 [FIN, ACK] Seq=2808 Ack=467 Win=407808 Len=0 TSval=3256884316 TSecr=1480427247
> 118	0.241530	127.0.0.1	127.0.0.1	TCP	56	56269 → 50010 [ACK] Seq=467 Ack=2809 Win=405440 Len=0 TSval=1480427247 TSecr=3256884316
> 119	0.364925	127.0.0.1	127.0.0.1	TCP	68	56270 → 50010 [SYN] Seq=0 Win=65535 Len=0 MSS=16344 WS=64 TSval=1146748745 TSecr=0 SACK_PERM
> 120	0.365159	127.0.0.1	127.0.0.1	TCP	68	50010 → 56270 [SYN, ACK] Seq=0 Ack=1 Win=65535 Len=0 MSS=16344 WS=64 TSval=1057135631 TSecr=1146748745 SACK_PERM
> 121	0.365194	127.0.0.1	127.0.0.1	TCP	56	56270 → 50010 [ACK] Seq=1 Ack=1 Win=408256 Len=0 TSval=1146748745 TSecr=1057135631
> 122	0.365212	127.0.0.1	127.0.0.1	HTTP	735	PUT /some-bucket HTTP/1.1 
> 123	0.365221	127.0.0.1	127.0.0.1	TCP	56	[TCP Window Update] 50010 → 56270 [ACK] Seq=1 Ack=1 Win=408256 Len=0 TSval=1057135631 TSecr=1146748745
> 124	0.365240	127.0.0.1	127.0.0.1	TCP	56	50010 → 56270 [ACK] Seq=1 Ack=680 Win=407616 Len=0 TSval=1057135631 TSecr=1146748745
> 125	0.369463	127.0.0.1	127.0.0.1	TCP	334	50010 → 56270 [PSH, ACK] Seq=1 Ack=680 Win=407616 Len=278 TSval=1057135636 TSecr=1146748745 [TCP PDU reassembled in 127]
> 126	0.369503	127.0.0.1	127.0.0.1	TCP	56	56270 → 50010 [ACK] Seq=680 Ack=279 Win=408000 Len=0 TSval=1146748750 TSecr=1057135636
> 127	0.369529	127.0.0.1	127.0.0.1	HTTP	221	HTTP/1.1 200 OK  (text/html)
> 128	0.369545	127.0.0.1	127.0.0.1	TCP	56	56270 → 50010 [ACK] Seq=680 Ack=444 Win=407808 Len=0 TSval=1146748750 TSecr=1057135636
> 129	0.369791	127.0.0.1	127.0.0.1	TCP	56	56270 → 50010 [FIN, ACK] Seq=680 Ack=444 Win=407808 Len=0 TSval=1146748750 TSecr=1057135636
> 130	0.369830	127.0.0.1	127.0.0.1	TCP	56	50010 → 56270 [ACK] Seq=444 Ack=681 Win=407616 Len=0 TSval=1057135636 TSecr=1146748750
> 131	0.369920	127.0.0.1	127.0.0.1	TCP	56	50010 → 56270 [FIN, ACK] Seq=444 Ack=681 Win=407616 Len=0 TSval=1057135636 TSecr=1146748750
> 132	0.369957	127.0.0.1	127.0.0.1	TCP	56	56270 → 50010 [ACK] Seq=681 Ack=445 Win=407808 Len=0 TSval=1146748750 TSecr=1057135636
> 133	0.371816	127.0.0.1	127.0.0.1	TCP	68	56271 → 50010 [SYN] Seq=0 Win=65535 Len=0 MSS=16344 WS=64 TSval=3369181934 TSecr=0 SACK_PERM
> 134	0.372025	127.0.0.1	127.0.0.1	TCP	68	50010 → 56271 [SYN, ACK] Seq=0 Ack=1 Win=65535 Len=0 MSS=16344 WS=64 TSval=3342980155 TSecr=3369181934 SACK_PERM
> 135	0.372103	127.0.0.1	127.0.0.1	TCP	56	56271 → 50010 [ACK] Seq=1 Ack=1 Win=408256 Len=0 TSval=3369181934 TSecr=3342980155
> 136	0.372126	127.0.0.1	127.0.0.1	TCP	829	56271 → 50010 [PSH, ACK] Seq=1 Ack=1 Win=408256 Len=773 TSval=3369181934 TSecr=3342980155 [TCP PDU reassembled in 143]
> 137	0.372173	127.0.0.1	127.0.0.1	TCP	56	[TCP Window Update] 50010 → 56271 [ACK] Seq=1 Ack=1 Win=408256 Len=0 TSval=3342980155 TSecr=3369181934
> 138	0.372220	127.0.0.1	127.0.0.1	TCP	56	50010 → 56271 [ACK] Seq=1 Ack=774 Win=407488 Len=0 TSval=3342980155 TSecr=3369181934
> 139	0.372751	127.0.0.1	127.0.0.1	HTTP	81	HTTP/1.1 100 Continue 
> 140	0.372797	127.0.0.1	127.0.0.1	TCP	56	56271 → 50010 [ACK] Seq=774 Ack=26 Win=408256 Len=0 TSval=3369181935 TSecr=3342980156
> 141	0.372830	127.0.0.1	127.0.0.1	HTTP	81	HTTP/1.1 100 Continue 
> 142	0.372858	127.0.0.1	127.0.0.1	TCP	56	56271 → 50010 [ACK] Seq=774 Ack=51 Win=408192 Len=0 TSval=3369181935 TSecr=3342980156
> 143	0.372928	127.0.0.1	127.0.0.1	HTTP	2305	PUT /some-bucket/input/input_1.csv HTTP/1.1 
> 144	0.372967	127.0.0.1	127.0.0.1	TCP	56	50010 → 56271 [ACK] Seq=51 Ack=3023 Win=405248 Len=0 TSval=3342980156 TSecr=3369181935
> 145	0.376259	127.0.0.1	127.0.0.1	HTTP	420	HTTP/1.1 200 OK 
> 146	0.376294	127.0.0.1	127.0.0.1	TCP	56	56271 → 50010 [ACK] Seq=3023 Ack=415 Win=407872 Len=0 TSval=3369181939 TSecr=3342980159
> 147	0.376478	127.0.0.1	127.0.0.1	TCP	56	56271 → 50010 [FIN, ACK] Seq=3023 Ack=415 Win=407872 Len=0 TSval=3369181939 TSecr=3342980159
> 148	0.376509	127.0.0.1	127.0.0.1	TCP	56	50010 → 56271 [ACK] Seq=415 Ack=3024 Win=405248 Len=0 TSval=3342980160 TSecr=3369181939
> 149	0.376587	127.0.0.1	127.0.0.1	TCP	56	50010 → 56271 [FIN, ACK] Seq=415 Ack=3024 Win=405248 Len=0 TSval=3342980160 TSecr=3369181939
> 150	0.376627	127.0.0.1	127.0.0.1	TCP	56	56271 → 50010 [ACK] Seq=3024 Ack=416 Win=407872 Len=0 TSval=3369181939 TSecr=3342980160
> 151	0.386874	127.0.0.1	127.0.0.1	TCP	68	56272 → 50010 [SYN] Seq=0 Win=65535 Len=0 MSS=16344 WS=64 TSval=257180574 TSecr=0 SACK_PERM
> 152	0.387107	127.0.0.1	127.0.0.1	TCP	68	50010 → 56272 [SYN, ACK] Seq=0 Ack=1 Win=65535 Len=0 MSS=16344 WS=64 TSval=1603865073 TSecr=257180574 SACK_PERM
> 153	0.387132	127.0.0.1	127.0.0.1	TCP	56	56272 → 50010 [ACK] Seq=1 Ack=1 Win=408256 Len=0 TSval=257180574 TSecr=1603865073
> 154	0.387149	127.0.0.1	127.0.0.1	TCP	810	56272 → 50010 [PSH, ACK] Seq=1 Ack=1 Win=408256 Len=754 TSval=257180574 TSecr=1603865073 [TCP PDU reassembled in 161]
> 155	0.387158	127.0.0.1	127.0.0.1	TCP	56	[TCP Window Update] 50010 → 56272 [ACK] Seq=1 Ack=1 Win=408256 Len=0 TSval=1603865073 TSecr=257180574
> 156	0.387180	127.0.0.1	127.0.0.1	TCP	56	50010 → 56272 [ACK] Seq=1 Ack=755 Win=407488 Len=0 TSval=1603865073 TSecr=257180574
> 157	0.387599	127.0.0.1	127.0.0.1	HTTP	81	HTTP/1.1 100 Continue 
> 158	0.387635	127.0.0.1	127.0.0.1	TCP	56	56272 → 50010 [ACK] Seq=755 Ack=26 Win=408256 Len=0 TSval=257180574 TSecr=1603865073
> 159	0.387657	127.0.0.1	127.0.0.1	HTTP	81	HTTP/1.1 100 Continue 
> 160	0.387672	127.0.0.1	127.0.0.1	TCP	56	56272 → 50010 [ACK] Seq=755 Ack=51 Win=408192 Len=0 TSval=257180574 TSecr=1603865073
> 161	0.387747	127.0.0.1	127.0.0.1	HTTP	64	PUT /some-bucket/a HTTP/1.1 
> 162	0.387776	127.0.0.1	127.0.0.1	TCP	56	50010 → 56272 [ACK] Seq=51 Ack=763 Win=407488 Len=0 TSval=1603865073 TSecr=257180574
> 163	0.391081	127.0.0.1	127.0.0.1	HTTP	420	HTTP/1.1 200 OK 
> 164	0.391127	127.0.0.1	127.0.0.1	TCP	56	56272 → 50010 [ACK] Seq=763 Ack=415 Win=407872 Len=0 TSval=257180578 TSecr=1603865077
> 165	0.391302	127.0.0.1	127.0.0.1	TCP	56	56272 → 50010 [FIN, ACK] Seq=763 Ack=415 Win=407872 Len=0 TSval=257180578 TSecr=1603865077
> 166	0.391354	127.0.0.1	127.0.0.1	TCP	56	50010 → 56272 [ACK] Seq=415 Ack=764 Win=407488 Len=0 TSval=1603865077 TSecr=257180578
> 167	0.391496	127.0.0.1	127.0.0.1	TCP	56	50010 → 56272 [FIN, ACK] Seq=415 Ack=764 Win=407488 Len=0 TSval=1603865077 TSecr=257180578
> 168	0.391547	127.0.0.1	127.0.0.1	TCP	56	56272 → 50010 [ACK] Seq=764 Ack=416 Win=407872 Len=0 TSval=257180578 TSecr=1603865077
> 169	0.391805	127.0.0.1	127.0.0.1	TCP	68	56273 → 50010 [SYN] Seq=0 Win=65535 Len=0 MSS=16344 WS=64 TSval=3921059901 TSecr=0 SACK_PERM
> 170	0.392036	127.0.0.1	127.0.0.1	TCP	68	50010 → 56273 [SYN, ACK] Seq=0 Ack=1 Win=65535 Len=0 MSS=16344 WS=64 TSval=1540248175 TSecr=3921059901 SACK_PERM
> 171	0.392060	127.0.0.1	127.0.0.1	TCP	56	56273 → 50010 [ACK] Seq=1 Ack=1 Win=408256 Len=0 TSval=3921059901 TSecr=1540248175
> 172	0.392080	127.0.0.1	127.0.0.1	TCP	56	[TCP Window Update] 50010 → 56273 [ACK] Seq=1 Ack=1 Win=408256 Len=0 TSval=1540248176 TSecr=3921059901
> 173	0.392081	127.0.0.1	127.0.0.1	HTTP	485	HEAD /some-bucket/a HTTP/1.1 
> 174	0.392108	127.0.0.1	127.0.0.1	TCP	56	50010 → 56273 [ACK] Seq=1 Ack=430 Win=407808 Len=0 TSval=1540248176 TSecr=3921059902
> 175	0.395526	127.0.0.1	127.0.0.1	HTTP	564	HTTP/1.1 200 OK 
> 176	0.395614	127.0.0.1	127.0.0.1	TCP	56	56273 → 50010 [ACK] Seq=430 Ack=509 Win=407744 Len=0 TSval=3921059906 TSecr=1540248180
> 177	0.395649	127.0.0.1	127.0.0.1	TCP	56	56273 → 50010 [FIN, ACK] Seq=430 Ack=509 Win=407744 Len=0 TSval=3921059906 TSecr=1540248180
> 178	0.395689	127.0.0.1	127.0.0.1	TCP	56	50010 → 56273 [ACK] Seq=509 Ack=431 Win=407808 Len=0 TSval=1540248180 TSecr=3921059906
> 179	0.395766	127.0.0.1	127.0.0.1	TCP	68	56274 → 50010 [SYN] Seq=0 Win=65535 Len=0 MSS=16344 WS=64 TSval=2186136863 TSecr=0 SACK_PERM
> 180	0.395996	127.0.0.1	127.0.0.1	TCP	56	50010 → 56273 [FIN, ACK] Seq=509 Ack=431 Win=407808 Len=0 TSval=1540248180 TSecr=3921059906
> 181	0.396047	127.0.0.1	127.0.0.1	TCP	68	50010 → 56274 [SYN, ACK] Seq=0 Ack=1 Win=65535 Len=0 MSS=16344 WS=64 TSval=1221821751 TSecr=2186136863 SACK_PERM
> 182	0.396085	127.0.0.1	127.0.0.1	TCP	56	56273 → 50010 [ACK] Seq=431 Ack=510 Win=407744 Len=0 TSval=3921059906 TSecr=1540248180
> 183	0.396114	127.0.0.1	127.0.0.1	TCP	56	56274 → 50010 [ACK] Seq=1 Ack=1 Win=408256 Len=0 TSval=2186136863 TSecr=1221821751
> 184	0.396133	127.0.0.1	127.0.0.1	HTTP	502	GET /some-bucket/a HTTP/1.1 
> 185	0.396154	127.0.0.1	127.0.0.1	TCP	56	[TCP Window Update] 50010 → 56274 [ACK] Seq=1 Ack=1 Win=408256 Len=0 TSval=1221821751 TSecr=2186136863
> 186	0.396172	127.0.0.1	127.0.0.1	TCP	56	50010 → 56274 [ACK] Seq=1 Ack=447 Win=407808 Len=0 TSval=1221821751 TSecr=2186136863
> 187	0.399276	127.0.0.1	127.0.0.1	TCP	605	50010 → 56274 [PSH, ACK] Seq=1 Ack=447 Win=407808 Len=549 TSval=1221821754 TSecr=2186136863 [TCP PDU reassembled in 189]
> 188	0.399379	127.0.0.1	127.0.0.1	TCP	56	56274 → 50010 [ACK] Seq=447 Ack=550 Win=407744 Len=0 TSval=2186136866 TSecr=1221821754
> 189	0.399424	127.0.0.1	127.0.0.1	HTTP	64	HTTP/1.1 206 PARTIAL CONTENT  (binary/octet-stream)
> 190	0.399445	127.0.0.1	127.0.0.1	TCP	56	56274 → 50010 [ACK] Seq=447 Ack=558 Win=407680 Len=0 TSval=2186136866 TSecr=1221821754
> 191	0.399482	127.0.0.1	127.0.0.1	TCP	56	56274 → 50010 [FIN, ACK] Seq=447 Ack=558 Win=407680 Len=0 TSval=2186136866 TSecr=1221821754
> 192	0.399542	127.0.0.1	127.0.0.1	TCP	56	50010 → 56274 [ACK] Seq=558 Ack=448 Win=407808 Len=0 TSval=1221821754 TSecr=2186136866
> 193	0.399657	127.0.0.1	127.0.0.1	TCP	56	50010 → 56274 [FIN, ACK] Seq=558 Ack=448 Win=407808 Len=0 TSval=1221821754 TSecr=2186136866
> 194	0.399704	127.0.0.1	127.0.0.1	TCP	56	56274 → 50010 [ACK] Seq=448 Ack=559 Win=407680 Len=0 TSval=2186136866 TSecr=1221821754
> 195	0.400639	127.0.0.1	127.0.0.1	TCP	68	56275 → 50010 [SYN] Seq=0 Win=65535 Len=0 MSS=16344 WS=64 TSval=1518333827 TSecr=0 SACK_PERM
> 196	0.400882	127.0.0.1	127.0.0.1	TCP	68	50010 → 56275 [SYN, ACK] Seq=0 Ack=1 Win=65535 Len=0 MSS=16344 WS=64 TSval=719409858 TSecr=1518333827 SACK_PERM
> 197	0.400925	127.0.0.1	127.0.0.1	TCP	56	56275 → 50010 [ACK] Seq=1 Ack=1 Win=408256 Len=0 TSval=1518333827 TSecr=719409858
> 198	0.400942	127.0.0.1	127.0.0.1	HTTP	502	GET /some-bucket/a HTTP/1.1 
> 199	0.400949	127.0.0.1	127.0.0.1	TCP	56	[TCP Window Update] 50010 → 56275 [ACK] Seq=1 Ack=1 Win=408256 Len=0 TSval=719409858 TSecr=1518333827
> 200	0.400973	127.0.0.1	127.0.0.1	TCP	56	50010 → 56275 [ACK] Seq=1 Ack=447 Win=407808 Len=0 TSval=719409858 TSecr=1518333827
> 201	0.403792	127.0.0.1	127.0.0.1	TCP	605	50010 → 56275 [PSH, ACK] Seq=1 Ack=447 Win=407808 Len=549 TSval=719409861 TSecr=1518333827 [TCP PDU reassembled in 203]
> 202	0.403827	127.0.0.1	127.0.0.1	TCP	56	56275 → 50010 [ACK] Seq=447 Ack=550 Win=407744 Len=0 TSval=1518333830 TSecr=719409861
> 203	0.403849	127.0.0.1	127.0.0.1	HTTP	64	HTTP/1.1 206 PARTIAL CONTENT  (binary/octet-stream)
> 204	0.403863	127.0.0.1	127.0.0.1	TCP	56	56275 → 50010 [ACK] Seq=447 Ack=558 Win=407680 Len=0 TSval=1518333830 TSecr=719409861
> 205	0.403888	127.0.0.1	127.0.0.1	TCP	56	56275 → 50010 [FIN, ACK] Seq=447 Ack=558 Win=407680 Len=0 TSval=1518333830 TSecr=719409861
> 206	0.403919	127.0.0.1	127.0.0.1	TCP	56	50010 → 56275 [ACK] Seq=558 Ack=448 Win=407808 Len=0 TSval=719409861 TSecr=1518333830
> 207	0.404001	127.0.0.1	127.0.0.1	TCP	56	50010 → 56275 [FIN, ACK] Seq=558 Ack=448 Win=407808 Len=0 TSval=719409861 TSecr=1518333830
> 208	0.404045	127.0.0.1	127.0.0.1	TCP	56	56275 → 50010 [ACK] Seq=448 Ack=559 Win=407680 Len=0 TSval=1518333830 TSecr=719409861
> 209	0.404544	127.0.0.1	127.0.0.1	TCP	68	56276 → 50010 [SYN] Seq=0 Win=65535 Len=0 MSS=16344 WS=64 TSval=1284585344 TSecr=0 SACK_PERM
> 210	0.404774	127.0.0.1	127.0.0.1	TCP	68	50010 → 56276 [SYN, ACK] Seq=0 Ack=1 Win=65535 Len=0 MSS=16344 WS=64 TSval=3650258141 TSecr=1284585344 SACK_PERM
> 211	0.404810	127.0.0.1	127.0.0.1	TCP	56	56276 → 50010 [ACK] Seq=1 Ack=1 Win=408256 Len=0 TSval=1284585345 TSecr=3650258141
> 212	0.404829	127.0.0.1	127.0.0.1	HTTP	501	HEAD /some-bucket/input/input_1.csv HTTP/1.1 
> 213	0.404835	127.0.0.1	127.0.0.1	TCP	56	[TCP Window Update] 50010 → 56276 [ACK] Seq=1 Ack=1 Win=408256 Len=0 TSval=3650258142 TSecr=1284585345
> 214	0.404855	127.0.0.1	127.0.0.1	TCP	56	50010 → 56276 [ACK] Seq=1 Ack=446 Win=407808 Len=0 TSval=3650258142 TSecr=1284585345
> 215	0.407783	127.0.0.1	127.0.0.1	HTTP	567	HTTP/1.1 200 OK 
> 216	0.407812	127.0.0.1	127.0.0.1	TCP	56	56276 → 50010 [ACK] Seq=446 Ack=512 Win=407744 Len=0 TSval=1284585348 TSecr=3650258145
> 217	0.407835	127.0.0.1	127.0.0.1	TCP	56	56276 → 50010 [FIN, ACK] Seq=446 Ack=512 Win=407744 Len=0 TSval=1284585348 TSecr=3650258145
> 218	0.407857	127.0.0.1	127.0.0.1	TCP	56	50010 → 56276 [ACK] Seq=512 Ack=447 Win=407808 Len=0 TSval=3650258145 TSecr=1284585348
> 219	0.407907	127.0.0.1	127.0.0.1	TCP	56	50010 → 56276 [FIN, ACK] Seq=512 Ack=447 Win=407808 Len=0 TSval=3650258145 TSecr=1284585348
> 220	0.407916	127.0.0.1	127.0.0.1	TCP	68	56277 → 50010 [SYN] Seq=0 Win=65535 Len=0 MSS=16344 WS=64 TSval=3629791145 TSecr=0 SACK_PERM
> 221	0.407939	127.0.0.1	127.0.0.1	TCP	56	56276 → 50010 [ACK] Seq=447 Ack=513 Win=407744 Len=0 TSval=1284585348 TSecr=3650258145
> 222	0.408062	127.0.0.1	127.0.0.1	TCP	68	50010 → 56277 [SYN, ACK] Seq=0 Ack=1 Win=65535 Len=0 MSS=16344 WS=64 TSval=3277172431 TSecr=3629791145 SACK_PERM
> 223	0.408094	127.0.0.1	127.0.0.1	TCP	56	56277 → 50010 [ACK] Seq=1 Ack=1 Win=408256 Len=0 TSval=3629791145 TSecr=3277172431
> 224	0.408112	127.0.0.1	127.0.0.1	HTTP	521	GET /some-bucket/input/input_1.csv HTTP/1.1 
> 225	0.408114	127.0.0.1	127.0.0.1	TCP	56	[TCP Window Update] 50010 → 56277 [ACK] Seq=1 Ack=1 Win=408256 Len=0 TSval=3277172431 TSecr=3629791145
> 226	0.408132	127.0.0.1	127.0.0.1	TCP	56	50010 → 56277 [ACK] Seq=1 Ack=466 Win=407808 Len=0 TSval=3277172431 TSecr=3629791145
> 227	0.410591	127.0.0.1	127.0.0.1	TCP	614	50010 → 56277 [PSH, ACK] Seq=1 Ack=466 Win=407808 Len=558 TSval=3277172434 TSecr=3629791145 [TCP PDU reassembled in 229]
> 228	0.410621	127.0.0.1	127.0.0.1	TCP	56	56277 → 50010 [ACK] Seq=466 Ack=559 Win=407680 Len=0 TSval=3629791148 TSecr=3277172434
> 229	0.410643	127.0.0.1	127.0.0.1	HTTP	2305	HTTP/1.1 206 PARTIAL CONTENT  (binary/octet-stream)
> 230	0.410657	127.0.0.1	127.0.0.1	TCP	56	56277 → 50010 [ACK] Seq=466 Ack=2808 Win=405440 Len=0 TSval=3629791148 TSecr=3277172434
> 231	0.410681	127.0.0.1	127.0.0.1	TCP	56	56277 → 50010 [FIN, ACK] Seq=466 Ack=2808 Win=405440 Len=0 TSval=3629791148 TSecr=3277172434
> 232	0.410705	127.0.0.1	127.0.0.1	TCP	56	50010 → 56277 [ACK] Seq=2808 Ack=467 Win=407808 Len=0 TSval=3277172434 TSecr=3629791148
> 233	0.410804	127.0.0.1	127.0.0.1	TCP	56	50010 → 56277 [FIN, ACK] Seq=2808 Ack=467 Win=407808 Len=0 TSval=3277172434 TSecr=3629791148
> 234	0.410846	127.0.0.1	127.0.0.1	TCP	56	56277 → 50010 [ACK] Seq=467 Ack=2809 Win=405440 Len=0 TSval=3629791148 TSecr=3277172434

**Comment by bblommers** [comment]
Hi @yuv-c,

The difference between `test_dttlv_duckdb_functionality` and `test_duckdb_functionality` lies in how it calls `DuckDB`. The context manager uses `duckdb.sql`, which fails - the other test uses `duckdb.execute`, which succeeds:
 
```
class DuckDBClient:
    def __init__(self, db_file: Optional[str] = None):
        self.duck_connection = duckdb.connect(db_file) if db_file else duckdb.connect()

    def __enter__(self):
        return self

    def __exit__(self, exc_type, exc_val, exc_tb):
        if self.duck_connection is not None:
            self.duck_connection.close()
        self.duck_connection = None

    def execute(self, sql: str):
        print(f"executing {sql}")
        use_execute = True
        if use_execute:
            # passes
            self.duck_connection.execute(sql)
            x = self.duck_connection.fetchall()
        else:
            # Fails
            x = self.duck_connection.sql(sql)
        print(x)
        return x
```

To get a little bit more debug info, you can shorten the HTTP timeout in DuckDB:
```
client.execute("SET http_retries = 2;")
client.execute("SET http_timeout = 3;")
```
Which gives the following error:
> duckdb.duckdb.IOException: IO Error: Failed to read connection error for HTTP HEAD to 'http://localhost:5000/some-bucket/input/input_1.csv'
>

Which.. is less then useful.

Debugging Moto tells me that the incoming request/response is exactly the same for `duckdb.sql` and `duckdb.execute`. So I don't understand why it fails for one, but not for the other.

Without more information on why DuckDB fails, it will be very hard to figure out what's going on. Would it be possible to reach out to them to figure out what's wrong with Moto's response?

**Comment by yuv-c** [comment]
> The difference between `test_dttlv_duckdb_functionality` and `test_duckdb_functionality` lies in how it calls `DuckDB`. The context manager uses `duckdb.sql`, which fails - the other test uses `duckdb.execute`, which succeeds:

Thank you @bblommers, you are correct.
I tried to make both tests identical but missed the fact that one uses `execute` while the other `sql`.

This solves the problem for me and i'm able to go ahead with my project.

However, i'm still curious as to why the `sql` call is succesfull only when using the moto from the CLI. 
I think this could still be a potential bug in `moto` since from the wireshark logs, you can see that the server (started by Python process, not CLI) received a HEAD with the correct path, but did not return a valid response (hanged).

> 83 0.211447 127.0.0.1 127.0.0.1 HTTP 501 HEAD /some-bucket/input/input_1.csv HTTP/1.1
> 84 0.211485 127.0.0.1 127.0.0.1 TCP 56 50010 → 56170 [ACK] Seq=1 Ack=446 Win=407808 Len=0 TSval=3236353137 TSecr=2125537756
****** Terminating the process after a few seconds...
> 85 7.877015 127.0.0.1 127.0.0.1 TCP 56 56170 → 50010 [FIN, ACK] Seq=446 Ack=1 Win=408256 Len=0 TSval=2125545422 TSecr=3236353137
> 86 7.877025 127.0.0.1 127.0.0.1 TCP 44 50010 → 56170 [RST, ACK] Seq=1 Ack=446 Win=407808 Len=0

See the time diff between 84 and 85 (where i killed the test).

As far as I am concerned, you can close the issue (as i'm able to go around the issue). 
I am not sure this is a bug with `moto` or `duckdb`, but I think it's worth a check as to why the server does not repsond (if i interpreted the logs correctly).

Thank you for the help!

**Comment by bblommers** [comment]
> why the server does not repsond (if i interpreted the logs correctly).

That's what I understand from the logs as well - but the Moto logs tell me that it does send a response. Maybe DuckDB expects a body from the HTTP request that we don't send, and that why it hangs? I'm not sure. 

Would be nice to debug the DuckDB-side to see where exactly it hangs, or why it retries. Unfortunately I don't have the time (or C++ skills) to really dig into this.

Glad to hear the workaround works!
